{
  "schema_version": "scenario_vulnerability_facts.annotation_context.v0.4",
  "created_from": "../scenario_vulnerability_facts.json",
  "use": "Evidence-Weighted Annotation self-contained auxiliary context",
  "scenarios": [
    {
      "scenario_id": "juice-shop",
      "scenario_type": "non_cve_training_app",
      "cve_ids": [],
      "product_hint": "OWASP Juice Shop",
      "affected_component_human": "OWASP Juice Shop",
      "official_context_summary": "Non-CVE / composite local context; no official CVE summary is asserted for this scenario.",
      "scenario_context_summary": "Non-CVE training context for OWASP Juice Shop. Local scene files define a Juice Shop server plus normal and designated attack bot activity, with application logs configured for the service. The context is useful only for recognizing the lab application and possible web-application artifacts; it does not establish any CVE, stage, or outcome by itself.",
      "mechanism_category": [
        "non-CVE training application context"
      ],
      "impact_category": [
        "no CVE impact asserted; use only to interpret local lab/service context"
      ],
      "attack_surface_hint": "OWASP Juice Shop training web application and its local bot-generated traffic.",
      "observable_artifact_hints": [
        "Look for primary-evidence events that reference OWASP Juice Shop training web application and its local bot-generated traffic rather than assuming the public public vulnerability context determines the stage.",
        "Application logs may contain request paths, response status changes, parser errors, stack traces, or authorization failures; use them only if present in primary evidence.",
        "Network traces can support context if they show timing, actor, and service alignment with the scenario, but they do not prove result stage by themselves.",
        "If present in primary evidence, look for service names, bot roles, timestamps, and app-log locations that connect events to the local lab scene."
      ],
      "stage_reasoning_hints": {
        "preparation": "Preparation may be assigned only from primary evidence showing setup, reconnaissance, access preparation, or capability checks. CVE/context metadata cannot be used as the stage label basis; final_judgement must cite seq and edge_id; do not turn vulnerability background into an attack result.",
        "execution": "Execution may be assigned only from primary evidence showing an observed interaction with the affected component or attack surface. CVE/context metadata cannot be used as the stage label basis; final_judgement must cite seq and edge_id; do not invent unseen request content or outcomes.",
        "result": "Result may be assigned only from primary evidence showing an observed outcome in logs, process/file/network activity, or other verified artifacts. CVE/context metadata cannot be used as the stage label basis; final_judgement must cite seq and edge_id; do not convert vulnerability background into a result.",
        "none": "None should be used when primary evidence does not support preparation, execution, or result. CVE/context metadata cannot be used as the stage label basis; final_judgement must cite seq and edge_id; do not write background vulnerability facts as observed activity."
      },
      "annotation_prompt_context": "This is auxiliary EWVAA annotation context for OWASP Juice Shop. No CVE is asserted; the context may help identify local lab services and composite scenario boundaries if present in primary evidence. The relevant attack surface can involve OWASP Juice Shop training web application and its local bot-generated traffic.. When annotating, look only for HTTP or service logs, process activity, file access, network evidence, or application messages if present in primary evidence. Do not infer stage or outcome from vulnerability context alone; final_judgement must cite primary evidence by seq and edge_id.",
      "source_extracts": [
        {
          "source_type": "OWASP",
          "summary": "OWASP Juice Shop is represented here as a non-CVE training application; the available local OWASP and challenge files can help identify the application context but do not establish EWVAA stage labels.",
          "confidence": "scenario_doc"
        },
        {
          "source_type": "LOCAL_CONTEXT",
          "summary": "Non-CVE training context for OWASP Juice Shop. Local scene files define a Juice Shop server plus normal and designated attack bot activity, with application logs configured for the service. The context is useful only for recognizing the lab application and possible web-application artifacts; it does not establish any CVE, stage, or outcome by itself.",
          "confidence": "local_context"
        }
      ],
      "quality_flags": {
        "needs_manual_review": true,
        "insufficient_context": false,
        "scenario_doc_missing": false,
        "non_cve_context_only": true,
        "source_extracts_embedded": true
      },
      "strict_use_constraints": {
        "must_not_use_as_primary_evidence": true,
        "must_not_invent_payload": true,
        "must_not_invent_success_result": true,
        "must_not_infer_stage_without_primary_evidence": true,
        "final_judgement_requires_primary_evidence": true
      }
    },
    {
      "scenario_id": "vulhub/gitlist/CVE-2018-1000533",
      "scenario_type": "cve",
      "cve_ids": [
        "CVE-2018-1000533"
      ],
      "product_hint": "GitList",
      "affected_component_human": "GitList (cpe:2.3:a:gitlist:gitlist:*:*:*:*:*:*:*:*)",
      "official_context_summary": "klaussilveira GitList version <= 0.6 contains a Passing incorrectly sanitized input to system function vulnerability in searchTree function that can result in Execute any code as PHP user. This attack appear to be abuseable via Send POST request using search form. This vulnerability appears to have been fixed in 0.7 after commit 87b8c26b023c3fc37f0796b14bb13710f397b322.",
      "scenario_context_summary": "GitList 0.6.0 code-execution related vulnerability metadata (CVE-2018-1000533) GitList is an elegant and modern git repository viewer. GitList version <= 0.6 contains a passing incorrectly sanitized input to system function vulnerability in searchTree function that can result in executing unexpected service-side actions as PHP user. This attack appear to be abuseable via POST request using search form.",
      "mechanism_category": [
        "public vulnerability context"
      ],
      "impact_category": [
        "publicly described security impact, requiring primary evidence before any stage or outcome judgement"
      ],
      "attack_surface_hint": "GitList repository browsing and search functionality exposed through the web application.",
      "observable_artifact_hints": [
        "Look for primary-evidence events that reference GitList repository browsing and search functionality exposed through the web application rather than assuming the public public vulnerability context determines the stage.",
        "Application logs may contain request paths, response status changes, parser errors, stack traces, or authorization failures; use them only if present in primary evidence.",
        "Network traces can support context if they show timing, actor, and service alignment with the scenario, but they do not prove result stage by themselves."
      ],
      "stage_reasoning_hints": {
        "preparation": "Preparation may be assigned only from primary evidence showing setup, reconnaissance, access preparation, or capability checks. CVE/context metadata cannot be used as the stage label basis; final_judgement must cite seq and edge_id; do not turn vulnerability background into an attack result.",
        "execution": "Execution may be assigned only from primary evidence showing an observed interaction with the affected component or attack surface. CVE/context metadata cannot be used as the stage label basis; final_judgement must cite seq and edge_id; do not invent unseen request content or outcomes.",
        "result": "Result may be assigned only from primary evidence showing an observed outcome in logs, process/file/network activity, or other verified artifacts. CVE/context metadata cannot be used as the stage label basis; final_judgement must cite seq and edge_id; do not convert vulnerability background into a result.",
        "none": "None should be used when primary evidence does not support preparation, execution, or result. CVE/context metadata cannot be used as the stage label basis; final_judgement must cite seq and edge_id; do not write background vulnerability facts as observed activity."
      },
      "annotation_prompt_context": "This is auxiliary EWVAA annotation context for GitList. The affected component is GitList (cpe:2.3:a:gitlist:gitlist:*:*:*:*:*:*:*:*), and the weakness category may be public vulnerability context. The relevant attack surface can involve GitList repository browsing and search functionality exposed through the web application.. When annotating, look only for HTTP or service logs, process activity, file access, network evidence, or application messages if present in primary evidence. Do not infer stage or outcome from vulnerability context alone; final_judgement must cite primary evidence by seq and edge_id.",
      "source_extracts": [
        {
          "source_type": "NVD",
          "summary": "klaussilveira GitList version <= 0.6 contains a Passing incorrectly sanitized input to system function vulnerability in searchTree function that can result in Execute any code as PHP user. This attack appear to be abuseable via Send POST request using search form. This vulnerability appears to have been fixed in 0.7 after commit.",
          "confidence": "official"
        },
        {
          "source_type": "CVE_PROGRAM",